{
  "metadata": {
    "title": "30sec Ghost Note Groove",
    "artist": "DrumScore AI",
    "source_audio": null,
    "created_by": "DrumScore AI",
    "schema_version": "1.0.0"
  },
  "average_bpm": 82.0,
  "time_signature": {
    "numerator": 4,
    "denominator": 4
  },
  "ticks_per_quarter": 480,
  "tempo_map": [
    {
      "time_sec": 0.0,
      "beat_index": 0.0,
      "bpm": 82.0,
      "confidence": 1.0
    },
    {
      "time_sec": 0.7317073170731707,
      "beat_index": 1.0,
      "bpm": 82.0,
      "confidence": 1.0
    },
    {
      "time_sec": 1.4634146341463414,
      "beat_index": 2.0,
      "bpm": 82.0,
      "confidence": 1.0
    },
    {
      "time_sec": 2.1951219512195124,
      "beat_index": 3.0,
      "bpm": 82.0,
      "confidence": 1.0
    },
    {
      "time_sec": 2.926829268292683,
      "beat_index": 4.0,
      "bpm": 82.0,
      "confidence": 1.0
    },
    {
      "time_sec": 3.6585365853658534,
      "beat_index": 5.0,
      "bpm": 82.0,
      "confidence": 1.0
    },
    {
      "time_sec": 4.390243902439025,
      "beat_index": 6.0,
      "bpm": 82.0,
      "confidence": 1.0
    },
    {
      "time_sec": 5.121951219512195,
      "beat_index": 7.0,
      "bpm": 82.0,
      "confidence": 1.0
    },
    {
      "time_sec": 5.853658536585366,
      "beat_index": 8.0,
      "bpm": 82.0,
      "confidence": 1.0
    },
    {
      "time_sec": 6.585365853658536,
      "beat_index": 9.0,
      "bpm": 82.0,
      "confidence": 1.0
    },
    {
      "time_sec": 7.317073170731707,
      "beat_index": 10.0,
      "bpm": 82.0,
      "confidence": 1.0
    },
    {
      "time_sec": 8.048780487804878,
      "beat_index": 11.0,
      "bpm": 82.0,
      "confidence": 1.0
    },
    {
      "time_sec": 8.78048780487805,
      "beat_index": 12.0,
      "bpm": 82.0,
      "confidence": 1.0
    },
    {
      "time_sec": 9.512195121951219,
      "beat_index": 13.0,
      "bpm": 82.0,
      "confidence": 1.0
    },
    {
      "time_sec": 10.24390243902439,
      "beat_index": 14.0,
      "bpm": 82.0,
      "confidence": 1.0
    },
    {
      "time_sec": 10.97560975609756,
      "beat_index": 15.0,
      "bpm": 82.0,
      "confidence": 1.0
    },
    {
      "time_sec": 11.707317073170731,
      "beat_index": 16.0,
      "bpm": 82.0,
      "confidence": 1.0
    },
    {
      "time_sec": 12.439024390243903,
      "beat_index": 17.0,
      "bpm": 82.0,
      "confidence": 1.0
    },
    {
      "time_sec": 13.170731707317072,
      "beat_index": 18.0,
      "bpm": 82.0,
      "confidence": 1.0
    },
    {
      "time_sec": 13.902439024390244,
      "beat_index": 19.0,
      "bpm": 82.0,
      "confidence": 1.0
    },
    {
      "time_sec": 14.634146341463413,
      "beat_index": 20.0,
      "bpm": 82.0,
      "confidence": 1.0
    },
    {
      "time_sec": 15.365853658536585,
      "beat_index": 21.0,
      "bpm": 82.0,
      "confidence": 1.0
    },
    {
      "time_sec": 16.097560975609756,
      "beat_index": 22.0,
      "bpm": 82.0,
      "confidence": 1.0
    },
    {
      "time_sec": 16.829268292682926,
      "beat_index": 23.0,
      "bpm": 82.0,
      "confidence": 1.0
    },
    {
      "time_sec": 17.5609756097561,
      "beat_index": 24.0,
      "bpm": 82.0,
      "confidence": 1.0
    },
    {
      "time_sec": 18.29268292682927,
      "beat_index": 25.0,
      "bpm": 82.0,
      "confidence": 1.0
    },
    {
      "time_sec": 19.024390243902438,
      "beat_index": 26.0,
      "bpm": 82.0,
      "confidence": 1.0
    },
    {
      "time_sec": 19.756097560975608,
      "beat_index": 27.0,
      "bpm": 82.0,
      "confidence": 1.0
    },
    {
      "time_sec": 20.48780487804878,
      "beat_index": 28.0,
      "bpm": 82.0,
      "confidence": 1.0
    },
    {
      "time_sec": 21.21951219512195,
      "beat_index": 29.0,
      "bpm": 82.0,
      "confidence": 1.0
    },
    {
      "time_sec": 21.95121951219512,
      "beat_index": 30.0,
      "bpm": 82.0,
      "confidence": 1.0
    },
    {
      "time_sec": 22.682926829268293,
      "beat_index": 31.0,
      "bpm": 82.0,
      "confidence": 1.0
    },
    {
      "time_sec": 23.414634146341463,
      "beat_index": 32.0,
      "bpm": 82.0,
      "confidence": 1.0
    },
    {
      "time_sec": 24.146341463414632,
      "beat_index": 33.0,
      "bpm": 82.0,
      "confidence": 1.0
    },
    {
      "time_sec": 24.878048780487806,
      "beat_index": 34.0,
      "bpm": 82.0,
      "confidence": 1.0
    },
    {
      "time_sec": 25.609756097560975,
      "beat_index": 35.0,
      "bpm": 82.0,
      "confidence": 1.0
    },
    {
      "time_sec": 26.341463414634145,
      "beat_index": 36.0,
      "bpm": 82.0,
      "confidence": 1.0
    },
    {
      "time_sec": 27.073170731707318,
      "beat_index": 37.0,
      "bpm": 82.0,
      "confidence": 1.0
    },
    {
      "time_sec": 27.804878048780488,
      "beat_index": 38.0,
      "bpm": 82.0,
      "confidence": 1.0
    },
    {
      "time_sec": 28.536585365853657,
      "beat_index": 39.0,
      "bpm": 82.0,
      "confidence": 1.0
    },
    {
      "time_sec": 29.268292682926827,
      "beat_index": 40.0,
      "bpm": 82.0,
      "confidence": 1.0
    }
  ],
  "sections": [
    {
      "id": "groove",
      "name": "Groove",
      "start_bar": 1,
      "end_bar": 10
    }
  ],
  "bars": [
    {
      "number": 1,
      "start_sec": 0.0,
      "end_sec": 2.926829268292683,
      "section_id": "groove",
      "rehearsal_mark": null
    },
    {
      "number": 2,
      "start_sec": 2.926829268292683,
      "end_sec": 5.853658536585366,
      "section_id": "groove",
      "rehearsal_mark": null
    },
    {
      "number": 3,
      "start_sec": 5.853658536585366,
      "end_sec": 8.78048780487805,
      "section_id": "groove",
      "rehearsal_mark": null
    },
    {
      "number": 4,
      "start_sec": 8.78048780487805,
      "end_sec": 11.707317073170731,
      "section_id": "groove",
      "rehearsal_mark": null
    },
    {
      "number": 5,
      "start_sec": 11.707317073170731,
      "end_sec": 14.634146341463413,
      "section_id": "groove",
      "rehearsal_mark": null
    },
    {
      "number": 6,
      "start_sec": 14.634146341463413,
      "end_sec": 17.5609756097561,
      "section_id": "groove",
      "rehearsal_mark": null
    },
    {
      "number": 7,
      "start_sec": 17.5609756097561,
      "end_sec": 20.48780487804878,
      "section_id": "groove",
      "rehearsal_mark": null
    },
    {
      "number": 8,
      "start_sec": 20.48780487804878,
      "end_sec": 23.414634146341463,
      "section_id": "groove",
      "rehearsal_mark": null
    },
    {
      "number": 9,
      "start_sec": 23.414634146341463,
      "end_sec": 26.341463414634145,
      "section_id": "groove",
      "rehearsal_mark": null
    },
    {
      "number": 10,
      "start_sec": 26.341463414634145,
      "end_sec": 29.268292682926827,
      "section_id": "groove",
      "rehearsal_mark": null
    }
  ],
  "chords": [
    {
      "bar": 1,
      "beat": 1.0,
      "symbol": "Cmaj7",
      "confidence": 0.5
    },
    {
      "bar": 3,
      "beat": 1.0,
      "symbol": "Am7",
      "confidence": 0.5
    },
    {
      "bar": 5,
      "beat": 1.0,
      "symbol": "Fmaj7",
      "confidence": 0.5
    },
    {
      "bar": 7,
      "beat": 1.0,
      "symbol": "G7",
      "confidence": 0.5
    }
  ],
  "drum_events": [
    {
      "id": "k-1-1",
      "time_sec": 0.0,
      "bar": 1,
      "beat": 1.0,
      "division": 0,
      "grid": 16,
      "instrument": "kick",
      "velocity": 95,
      "articulation": "normal",
      "duration_sec": 0.05,
      "confidence": 1.0,
      "source": "human"
    },
    {
      "id": "h-1-1",
      "time_sec": 0.0,
      "bar": 1,
      "beat": 1.0,
      "division": 0,
      "grid": 16,
      "instrument": "hihat_closed",
      "velocity": 72,
      "articulation": "normal",
      "duration_sec": 0.05,
      "confidence": 1.0,
      "source": "human"
    },
    {
      "id": "k-1-2",
      "time_sec": 0.7317073170731707,
      "bar": 1,
      "beat": 2.0,
      "division": 0,
      "grid": 16,
      "instrument": "hihat_closed",
      "velocity": 95,
      "articulation": "normal",
      "duration_sec": 0.05,
      "confidence": 1.0,
      "source": "human"
    },
    {
      "id": "h-1-2",
      "time_sec": 0.7317073170731707,
      "bar": 1,
      "beat": 2.0,
      "division": 0,
      "grid": 16,
      "instrument": "hihat_closed",
      "velocity": 72,
      "articulation": "normal",
      "duration_sec": 0.05,
      "confidence": 1.0,
      "source": "human"
    },
    {
      "id": "s-1-2",
      "time_sec": 0.7317073170731707,
      "bar": 1,
      "beat": 2.0,
      "division": 0,
      "grid": 16,
      "instrument": "snare",
      "velocity": 105,
      "articulation": "normal",
      "duration_sec": 0.05,
      "confidence": 1.0,
      "source": "human"
    },
    {
      "id": "g-1-2",
      "time_sec": 1.0975609756097562,
      "bar": 1,
      "beat": 2.0,
      "division": 2,
      "grid": 16,
      "instrument": "snare_ghost",
      "velocity": 34,
      "articulation": "ghost",
      "duration_sec": 0.05,
      "confidence": 1.0,
      "source": "human"
    },
    {
      "id": "k-1-3",
      "time_sec": 1.4634146341463414,
      "bar": 1,
      "beat": 3.0,
      "division": 0,
      "grid": 16,
      "instrument": "kick",
      "velocity": 95,
      "articulation": "normal",
      "duration_sec": 0.05,
      "confidence": 1.0,
      "source": "human"
    },
    {
      "id": "h-1-3",
      "time_sec": 1.4634146341463414,
      "bar": 1,
      "beat": 3.0,
      "division": 0,
      "grid": 16,
      "instrument": "hihat_closed",
      "velocity": 72,
      "articulation": "normal",
      "duration_sec": 0.05,
      "confidence": 1.0,
      "source": "human"
    },
    {
      "id": "k-1-4",
      "time_sec": 2.1951219512195124,
      "bar": 1,
      "beat": 4.0,
      "division": 0,
      "grid": 16,